<?xml version="1.0"  encoding="UTF-8"?>
<!DOCTYPE DTD_Jornada SYSTEM "DTD_Jugador_Equipo_Dueño.dtd">

		
	<equipos>
		<equipo cod_equipo="">
			<nombre></nombre>
			<nacionalidad></nacionalidad>
			<presupuesto></presupuesto>
			<puntuacion></puntuacion>
		<jugadores>
			<jugador cod_jugador="">
				<nombre></nombre>
				<apellido></apellido>
				<nickname></nickname>
				<sueldo></sueldo>
				<nacionalidad></nacionalidad>
				<estado></estado>
				<telefono></telefono>
			</jugador>
		</jugadores>
		<dueño cod_cuenta="">
			<nombre></nombre>
			<apellido></apellido>
			<usuario></usuario>
			<contraseña></contraseña>
		</dueño>
		</equipo>
	</equipos>
	
	